task_name,pct
file data and related information and maintain and update databases.,0.0019543719300074264
"fill cracks, holes, or joints with caulk, putty, plaster, or other fillers, using caulking guns or putty knives.",0.0023452463160089122
fill pipes or plumbing fixtures with water or air and observe pressure gauges to detect and locate leaks.,0.004429909708016834
follow ethical codes that protect the confidentiality of information.,0.003778452398014358
"follow recipes to produce food products of specified flavor, texture, clarity, bouquet, or color.",0.11374444632643224
follow relevant safety regulations and state laws governing vehicle operation and ensure that passengers follow safety regulations.,0.002084663392007922
"follow special cargo-related procedures, such as checking refrigeration systems for frozen foods or providing food or water for livestock.",0.0029967036260113876
"forecast and track marketing and sales trends, analyzing collected data.",0.010553608422040103
"formulate and implement training programs, applying principles of learning and individual differences.",0.00560253286602129
"formulate basic layout design or presentation approach and specify material details, such as style and size of type, photographs, graphics, animation, video, and sound.",0.015895558364060404
"formulate environmental plan to be practical, esthetic, and conducive to intended purposes, such as raising productivity or selling merchandise.",0.0031269950880118825
formulate general rules that describe and predict the development and behavior of cultures and social institutions.,0.04390822269416685
"formulate herbal preparations to treat conditions considering herbal properties such as taste, toxicity, effects of preparation, contraindications, and incompatibilities.",0.003387578012012873
"formulate mathematical models or other methods of computer analysis to develop, evaluate, or modify design, according to customer engineering requirements.",0.005993407252022775
"formulate mathematical or simulation models of problems, relating constants and variables, restrictions, alternatives, conflicting objectives, and their numerical parameters.",0.058109992052220824
formulate or implement sustainability campaign or marketing strategies.,0.003778452398014358
formulate or modify recipes for specific kinds of food products.,0.008078070644030697
formulate policies and procedures for bid proposals and procurement of goods and services.,0.002214954854008417
"formulate policies and procedures related to public information programs, working with public relations executives.",0.004560201170017329
"formulate policies, procedures and programs for recruitment, testing, placement, classification, orientation, benefits and compensation, and labor and industrial relations.",0.005341949942020299
"formulate pricing policies for merchandise, according to profitability requirements.",0.0029967036260113876
formulate pricing policies on merchandise according to profitability requirements.,0.002084663392007922
"formulate recommendations, policies, or plans to solve economic problems or to interpret markets.",0.04130239345415695
formulate strategic plans for the institution.,0.005081367018019309
"formulate, direct, or coordinate marketing activities or policies to promote products or services, working with advertising or promotion managers.",0.07283292725827677
furnish customers with information on events or activities.,0.005211658480019804
furnish taxpayers with sufficient information and advice to ensure correct tax form completion.,0.011856523042045054
"gather and analyze research data, such as statutes, decisions, and legal articles, codes, and documents.",0.002736120702010397
"gather and compile geographic data from sources including censuses, field observations, satellite imagery, aerial photographs, and existing maps.",0.002475537778009407
gather and organize information on problems or procedures.,0.008599236492032676
gather and organize information to plan advertising campaigns.,0.011465648656043569
"gather data from sources such as surface or upper air stations, satellites, weather bureaus, or radar for use in meteorological reports or forecasts.",0.007817487720029706
"gather data on competitors and analyze their prices, sales, and method of marketing and distribution.",0.015374392516058422
"gather data pertaining to customer needs, and use the information to identify, predict, interpret, and evaluate system and network requirements.",0.0019543719300074264
"gather diagnostic data from sources such as case documentation, observations of clients, or interviews with clients or family members.",0.004299618246016338
gather financial documents related to investigations.,0.008729527954033171
"gather historical data from sources such as archives, court records, diaries, news files, and photographs, as well as collect data sources such as books, pamphlets, and periodicals.",0.03843598129014606
"gather information from doctors, schools, social workers, juvenile counselors, law enforcement personnel, and others to make recommendations to courts for resolution of child custody or visitation disputes.",0.004560201170017329
"gather intelligence information by field observation, confidential information sources, or public records.",0.01276856327604852
"gather records pertinent to specific problems, review them for completeness and accuracy, and attach records to correspondence as necessary.",0.02475537778009407
"gather, analyze, correlate, or evaluate information from a variety of resources, such as law enforcement databases.",0.004951075556018814
"gather, analyze, or document user feedback to locate or resolve sources of problems.",0.003648160936013863
"generate financial ratios, using computer programs, to evaluate customers' financial status.",0.002084663392007922
"generate lists of properties for sale, their locations, descriptions, and available financing options, using computers.",0.003778452398014358
generate lists of properties that are compatible with buyers' needs and financial resources.,0.0035178694740133683
generate or identify sales leads for green products and technologies.,0.002214954854008417
"generate standard or custom reports summarizing business, financial, or economic data for review by executives, managers, clients, and other stakeholders.",0.20273351487277036
"grade food products according to government regulations or according to type, color, bouquet, and moisture content.",0.0035178694740133683
"grade homework and tests, and compute and record results, using answer sheets or electronic marking devices.",0.0046904926320178245
greet customers and ascertain what each customer wants or needs.,0.03765423251814309
greet customers and ask about the quality of service they are receiving.,0.0046904926320178245
greet customers entering establishments.,0.02267071438808615
"greet passengers, provide information, and answer questions concerning fares, schedules, transfers, and routings.",0.008338653568031687
greet visitors or callers and handle their inquiries or direct them to the appropriate persons according to their needs.,0.006514573100024756
"guide and counsel students with adjustment or academic problems, or special academic interests.",0.06462456515224557
"guide and counsel students with adjustments or academic problems, or special academic interests.",0.003387578012012873
guide clients in the development of skills or strategies for dealing with their problems.,0.529765084494013
"guide clients in the gathering of information, such as bank account records, income tax returns, life and disability insurance records, pension plans, or wills.",0.004429909708016834
guide design discussions between development teams.,0.002866412164010892
handle customer complaints and take appropriate action to resolve them.,0.002736120702010397
hear and resolve complaints from customers or the public.,0.004039035322015348
help children with homework and school work.,0.004039035322015348
help develop or monitor family schedule.,0.005993407252022775
"help patrons find and use library resources, such as reference materials, audio-visual equipment, computers, and other electronic resources and provide technical assistance when needed.",0.008078070644030697
"help physicians, radiation oncologists, or clinical physicists to prepare physical or technical aspects of radiation treatment plans, using information about patient condition and anatomy.",0.003387578012012873
help programmers and systems analysts test and debug new programs.,0.16104024703261197
"hold public meetings with government officials, social scientists, lawyers, developers, the public, or special interest groups to formulate, develop, or address issues regarding land use or community plans.",0.00638428163802426
"identify and analyze areas of potential risk to the assets, earning capacity, or success of organizations.",0.006253990176023765
identify and analyze industry or geographic trends with business strategy implications.,0.02045575953407773
identify and build relationships with potential donors.,0.005732824328021784
"identify and classify documents or other electronic content according to characteristics such as security level, function, and metadata.",0.002605829240009902
"identify and document goals, anticipated progress, and plans for reevaluation.",0.00586311579002228
identify and evaluate industry trends in database systems to serve as a source of information and advice for upper management.,0.002214954854008417
"identify and implement benefits to increase the quality of life for employees, by working with brokers and researching benefits issues.",0.0023452463160089122
"identify and quantify drugs or poisons found in biological fluids or tissues, in foods, or at crime scenes.",0.002214954854008417
identify and recruit potential volunteer workers.,0.004951075556018814
identify and report problems in obtaining valid data.,0.04130239345415695
identify and resolve inconsistencies in interviewees' responses by means of appropriate questioning or explanation.,0.002084663392007922
identify and respond to emergency physical or mental health situations.,0.01172623158004456
"identify and share research, recommendations, or other information regarding legal liabilities, risk management, or quality of care.",0.007947779182030202
identify and troubleshoot equipment problems.,0.003387578012012873
identify appropriate key performance indicators (kpis) and report key metrics from digital campaigns.,0.005732824328021784
"identify children showing signs of emotional, developmental, or health-related problems and discuss them with supervisors, parents or guardians, and child development specialists.",0.002084663392007922
identify compliance issues that require follow-up or investigation.,0.004429909708016834
"identify defective sectionalizing devices, circuit breakers, fuses, voltage regulators, transformers, switches, relays, or wiring, using wiring diagrams and electrical-testing instruments.",0.0023452463160089122
identify defects in solid materials using ultrasonic testing techniques.,0.0019543719300074264
identify energy savings opportunities and make recommendations to achieve more energy efficient operation.,0.005472241404020794
"identify environmental requirements of a particular species, and select and oversee the preparation of sites for species cultivation.",0.007556904796028716
identify funding sources and write grant proposals for eligible programs or services.,0.0046904926320178245
identify group or individual target investors for a specific fund.,0.002475537778009407
"identify installation locations with proper orientation, area, solar access, or structural integrity for photovoltaic (pv) arrays.",0.006775156024025746
identify issues for research and analysis.,0.024103920470091595
"identify key risks and mitigating factors of potential investments, such as asset types and values, legal and ownership structures, professional reputations, customer bases, or industry segments.",0.0066448645620252504
"identify main client groups and audiences, determine the best way to communicate publicity information to them, and develop and implement a communication plan.",0.008599236492032676
identify methods for interfacing web application technologies with enterprise resource planning or other system software.,0.034527237430131204
"identify opportunities for strategic improvement or mitigation of business interruption and other risks caused by business, regulatory, or industry-specific change initiatives.",0.003257286550012378
identify opportunities or develop channels for purchase or sale of securities or commodities.,0.00612369871402327
"identify opportunities to improve plant electrical equipment, controls, or process control methodologies.",0.00638428163802426
"identify opportunities to improve the operation, maintenance, or energy efficiency of building or process systems.",0.0023452463160089122
"identify opportunities to reuse or recycle materials to minimize consumption of new materials, minimize waste, or to convert wastes to by-products.",0.002214954854008417
"identify or classify species of insects or allied forms, such as mites or spiders.",0.004169326784015844
identify or develop business rules or standard operating procedures to streamline operating processes.,0.004039035322015348
identify or maintain links to and from other web sites and check links to ensure proper functioning.,0.010293025498039114
"identify or recommend integrated weed and pest management (ipm) strategies, such as resistant plants, cultural or behavioral controls, soil amendments, insects, natural enemies, barriers, or pesticides.",0.003648160936013863
identify or separate waste products or materials for recycling or reuse.,0.004560201170017329
"identify plants as well as problems such as diseases, weeds, and insect pests.",0.002475537778009407
"identify potential clients, using advertising campaigns, mailing lists, or personal contacts.",0.006775156024025746
identify potential for loss and develop strategies to eliminate it.,0.058109992052220824
"identify prospective customers by using business directories, following leads from existing clients, participating in organizations and clubs, and attending trade shows and conferences.",0.002866412164010892
"identify protocol problems, inform investigators of problems, or assist in problem resolution efforts such as protocol revisions.",0.0023452463160089122
"identify psychological, emotional, or behavioral issues and diagnose disorders, using information obtained from interviews, tests, records, and reference materials.",0.008338653568031687
"identify relationships and trends in data, as well as any factors that could affect the results of research.",0.0988912196583758
identify solutions to on-site technical design problems involving electrical systems equipment.,0.004951075556018814
"identify spatial coordinates, using remote sensing and global positioning system (gps) data.",0.002475537778009407
"identify system data, hardware, or software components required to meet user needs.",0.009380985264035649
"identify target markets for designs, looking at factors such as age, gender, and socioeconomic status.",0.0046904926320178245
"identify tissue structures or cell components to be used in the diagnosis, prevention, or treatment of diseases.",0.008729527954033171
identify training needs or conduct training sessions for nursing students or medical staff.,0.002475537778009407
identify transaction mistakes when debits and credits do not balance.,0.005341949942020299
"identify, compile, abstract, and code patient data, using standard classification systems.",0.008599236492032676
"identify, develop, or evaluate marketing strategy, based on knowledge of establishment objectives, market characteristics, and cost and markup factors.",0.008338653568031687
"identify, evaluate and recommend hardware or software technologies to achieve desired database performance.",0.03061849357011635
"identify, investigate, or resolve security breaches.",0.07504788211228519
"identify, monitor, or treat pregnancy-related problems such as hypertension, gestational diabetes, pre-term labor, and retarded fetal growth.",0.002214954854008417
"identify, review, or select vendors or consultants to meet project needs.",0.002475537778009407
"identify, standardize, and communicate levels of access and security.",0.034396945968130706
"identify, track, or maintain metrics for trading system operations.",0.027100624096102983
"implement business rules via stored procedures, middleware, or other technologies.",0.019022553452072287
"implement changes to machine programs and enter new specifications, using computers.",0.061758152988234685
"implement controls to provide security for operating systems, software, and data.",0.05472241404020794
"implement electronic document processing, retrieval, and distribution systems in collaboration with other information technology specialists.",0.010944482808041589
"implement grant-funded projects, monitoring and reporting progress in accordance with sponsoring agency requirements.",0.005341949942020299
implement online customer service processes to ensure positive and consistent user experiences.,0.005081367018019309
implement or monitor processes to reduce property or financial losses.,0.010293025498039114
"implement security practices to preserve assets, minimize liabilities, or ensure customer privacy, using parallel servers, hardware redundancy, fail-safe technology, information encryption, or firewalls.",0.028142955792106947
"implement specific customer requirements, such as internal reporting or customized transportation metrics.",0.002866412164010892
"implement web site security measures, such as firewalls or message encryption.",0.019543719300074265
"import text and art elements, such as electronic clip art or electronic files from photographs that have been scanned or produced with a digital camera, using computer software.",0.002475537778009407
"improve search-related activities through ongoing analysis, experimentation, or optimization tests, using a/b or multivariate methods.",0.009511276726036143
"induce changes in composition of substances by introducing heat, light, energy, or chemical catalysts for quantitative or qualitative analysis.",0.005993407252022775
inform and advise concerned parties regarding fluctuations or securities transactions affecting plans or accounts.,0.014722935206055946
"inform businesses, community groups, and governmental agencies about educational needs, available programs, and program policies.",0.023322171698088624
"inform clients of essential travel information, such as travel times, transportation connections, and medical and visa requirements.",0.0029967036260113876
"inform clients of factors such as shipping options, timelines, transfers, or regulations affecting shipments.",0.009902151112037629
inform customers by mail or telephone of additional steps they need to take to obtain licenses.,0.002736120702010397
"inform customers by mail or telephone of order information, such as unit prices, shipping dates, and any anticipated delays.",0.004820784094018319
inform individuals and groups about the financial assistance available to college or university students.,0.003648160936013863
"inform individuals and groups of pollution control regulations and inspection findings, and explain how problems can be corrected.",0.004299618246016338
"inform investment decisions by analyzing financial information to forecast business, industry, or economic conditions.",0.01706818152206486
inform job applicants of their acceptance or rejection of employment.,0.016937890060064364
"inform local, state, national and international health policies related to information management and communication, confidentiality and security, patient safety, infrastructure development and economics.",0.003387578012012873
"inform other traders, managers, or customers of market conditions, including volume, price, competition, or dynamics.",0.01758934737006684
inform patients or caregivers about study aspects and outcomes to be expected.,0.0066448645620252504
inform patrons of establishment specialties and features.,0.003387578012012873
"inform personnel of changes in regulations and policies, implications of new or amended laws, and new techniques of police work.",0.0029967036260113876
inform workers about interests or special needs of specific groups.,0.00560253286602129
"initiate and direct efforts to foster tolerance, understanding, and appreciation of diversity in school communities.",0.0029967036260113876
initiate market research studies or analyze their findings.,0.0035178694740133683
"initiate, facilitate, and moderate classroom discussions.",0.03687248374614011
"inspect and adjust security systems, equipment, or machinery to ensure operational use and to detect evidence of tampering.",0.002736120702010397
inspect and evaluate the physical condition of facilities to determine the type of work required.,0.003648160936013863
"inspect and test electrical systems and equipment to locate and diagnose malfunctions, using visual inspections, testing devices, and computer software.",0.012638271814048026
inspect and verify dimensions and clearances of parts to ensure conformance to factory specifications.,0.03569986058813566
"inspect electrical connections, wiring, relays, charging resistance boxes, and storage batteries, following wiring diagrams.",0.0023452463160089122
inspect event facilities to ensure that they conform to customer requirements.,0.006775156024025746
inspect facilities to determine maintenance needs.,0.002084663392007922
inspect food products and processing procedures to determine whether products are safe to eat.,0.005081367018019309
"inspect individual parts, assemblies, or installations, using measuring instruments, such as calipers, scales, or micrometers.",0.02736120702010397
inspect industrial or municipal facilities or programs to evaluate operational effectiveness or ensure compliance with environmental regulations.,0.0019543719300074264
"inspect layouts and advertising copy and edit scripts, audio and video tapes, and other promotional material for adherence to specifications.",0.010162734036038618
"inspect or monitor energy systems, including heating, ventilating, and air conditioning (hvac) or daylighting systems to determine energy use or potential energy savings.",0.0031269950880118825
inspect project sites to monitor progress and ensure conformance to design specifications and safety or sanitation standards.,0.003778452398014358
"inspect properties to evaluate construction, condition, special features, and functional design, and to take property measurements.",0.0023452463160089122
inspect public establishments to ensure compliance with rules and regulations.,0.002736120702010397
"inspect security design features, installations, or programs to ensure compliance with applicable standards or regulations.",0.002605829240009902
"inspect structures to assess material or equipment needs, to establish the sequence of pipe installations, or to plan installation around obstructions such as electrical wiring.",0.007296321872027726
"inspect used parts to determine changes in dimensional requirements, using rules, calipers, micrometers, or other measuring instruments.",0.003387578012012873
"inspect, test, and listen to defective equipment to diagnose malfunctions, using test instruments such as handheld computers, motor analyzers, chassis charts, and pressure gauges.",0.004560201170017329
"inspect, weigh, and measure mounted or unmounted lenses after completion to verify alignment and conformance to specifications, using precision instruments.",0.007166030410027231
install and configure hypertext transfer protocol (http) servers and associated operating systems.,0.003257286550012378
"install and configure new equipment, including operating software or peripheral equipment.",0.054982996964208934
"install and perform minor repairs to hardware, software, or peripheral equipment, following design or installation specifications.",0.01784993029406783
install bookkeeping systems and resolve system problems.,0.0031269950880118825
"install or configure web server software or hardware to ensure that directory structure is well-defined, logical, secure, and that files are named properly.",0.005732824328021784
"install systems of recording costs or other financial and budgetary data or provide advice on such systems, based on examination of current financial records.",0.0035178694740133683
"install updated software, and programs that maintain existing software or provide requested features such as time-correlated call routing.",0.007166030410027231
"install, adjust, and operate electronic equipment to record, edit, and transmit radio and television programs, motion pictures, video conferencing, or multimedia presentations.",0.005211658480019804
"install, inspect and test electric meters, relays, and power sources to detect causes of malfunctions and inaccuracies, using hand tools and testing equipment.",0.0019543719300074264
"install, service, and repair electronic equipment or instruments such as televisions, radios, and videocassette recorders.",0.024885669242094566
"instruct and counsel patients about prescribed therapeutic regimens, normal growth and development, family planning, emotional problems of daily living, and health maintenance.",0.0019543719300074264
"instruct clients in techniques for more effective communication, such as sign language, lip reading, or voice improvement.",0.0029967036260113876
instruct customers on the safe and proper use of equipment.,0.0019543719300074264
"instruct in use of voice, video, and data communications systems.",0.004039035322015348
instruct individuals and groups on ways to preserve health and prevent disease.,0.003257286550012378
