task_name,pct
act as advisers to student organizations.,0.006775156024025746
act as an advocate for farmers or farmers' groups.,0.0029967036260113876
act as an intermediary in negotiations between buyers and sellers over property prices and settlement details and during the closing of sales.,0.012638271814048026
"act as an intermediary in negotiations between buyers and sellers, generally representing one or the other.",0.011465648656043569
act as liaisons between clients and medical staff.,0.0019543719300074264
act as liaisons between on-site managers or tenants and owners.,0.005081367018019309
"act as liaisons between ships' captains and shore personnel to ensure that schedules and budgets are maintained, and that ships are operated safely and efficiently.",0.0031269950880118825
adapt instructional content or delivery methods for different levels or types of learners.,0.13393962293650896
adapt instructional techniques to the age and skill levels of students.,0.002866412164010892
adapt software and accompanying technical documents to another language and culture.,0.003908743860014853
adapt teaching methods and instructional materials to meet students' varying needs and interests.,0.09628539041836588
adapt text to accommodate musical requirements of composers and singers.,0.022019257078083672
adapt the quantity of ingredients to match the amount of items to be baked.,0.02019517661007674
"adapt translations to students' cognitive and grade levels, collaborating with educational team members as necessary.",0.02697033263410249
"address employee relations issues, such as harassment allegations, work complaints, or other employee concerns.",0.002605829240009902
"address legal issues, such as child abuse and discipline, assisting with hearings and providing testimony to inform custody arrangements.",0.003648160936013863
address public audiences to explain program objectives and to elicit support.,0.004299618246016338
"address the relationships of quantities, magnitudes, and forms through the use of numbers and symbols.",0.19634923323474615
"adjust controls of equipment to control particle beam movement, pulse rates, energy or intensity, or radiation, according to specifications.",0.004039035322015348
"adjust controls to regulate temperature, pressure, feed, or flow of liquids or gases and times of prescribed reactions, according to knowledge of equipment and processes.",0.005732824328021784
"adjust functional parts of devices or control instruments, using hand tools, levels, plumb bobs, or straightedges.",0.004560201170017329
adjust sales scripts to better target the needs and interests of specific individuals.,0.007166030410027231
"adjust, maintain, or repair laboratory equipment such as microscopes.",0.0023452463160089122
"adjust, repair, or replace malfunctioning components or assemblies, using hand tools or soldering irons.",0.002084663392007922
administer document and system access rights and revision control to ensure security of system and integrity of master documents.,0.030488202108115856
"administer highway planning, construction, or maintenance.",0.004560201170017329
administer online purchasing systems.,0.012898854738049016
administer standardized ability and achievement tests and interpret results to determine students' strengths and areas of need.,0.007166030410027231
"administer systems and programs to reduce loss, maintain inventory control, or increase safety.",0.002605829240009902
"administer treatments or therapies, such as homeopathy, hydrotherapy, oriental or ayurvedic medicine, electrotherapy and diathermy, using physical agents including air, heat, cold, water, sound, or ultraviolet light to catalyze the body to heal itself.",0.008338653568031687
"administer, dispense, or prescribe natural medicines such as food or botanical extracts, herbs, dietary supplements, vitamins, nutraceuticals, and amino acids.",0.010032442574038123
"administer, proctor, or score academic or diagnostic assessments.",0.013159437662050005
"advise animal owners regarding sanitary measures, feeding, general care, medical conditions, or treatment options.",0.01680759859806387
"advise attorneys, juries, litigants, and court personnel regarding conduct, issues, and proceedings.",0.0035178694740133683
"advise business or other groups on local, national, or international factors affecting the buying or selling of products or services.",0.015113809592057431
"advise client on interior design factors such as space planning, layout and use of furnishings or equipment, and color coordination.",0.012638271814048026
"advise clients concerning business transactions, claim liability, advisability of prosecuting or defending lawsuits, or legal rights and obligations.",0.014332060820054462
advise clients on financial and legal matters such as investments and taxes.,0.028403538716107932
advise clients on how they could be helped by counseling.,0.021628382692082188
"advise clients on market conditions, prices, mortgages, legal requirements and related matters.",0.05719795181821735
advise clients on transportation and payment methods.,0.002475537778009407
"advise clients or community groups on issues related to improving general health, such as diet or exercise.",0.0023452463160089122
"advise clients or respond to inquiries about financial matters in person or via phone, email, web site, or internet chat.",0.002475537778009407
"advise construction firms or government agencies on dam or road construction, foundation design, land use, or resource management.",0.0066448645620252504
advise corporations on issues involving corporate image projects or problems.,0.014201769358053966
advise customer about or perform maintenance of software system.,0.007687196258029211
"advise customers concerning equipment operation, maintenance, or programming.",0.0019543719300074264
advise customers of necessary actions and strategies for debt repayment.,0.009641568188036638
"advise customers on import and export restrictions, tariff systems, insurance requirements, quotas, or other customs-related matters.",0.003387578012012873
advise customers on product usage to improve production.,0.0019543719300074264
advise customers on use and care of merchandise.,0.003387578012012873
advise dealers and distributors on policies and operating procedures to ensure functional effectiveness of business.,0.002736120702010397
advise farm groups or growers on land preparation or livestock care techniques that will maximize the quantity and quality of production.,0.003648160936013863
"advise farmers and demonstrate techniques in areas such as feeding and health maintenance of livestock, growing and harvesting practices, and financial planning.",0.010553608422040103
advise farmers or growers of development programs or new equipment or techniques to aid in quality production.,0.011335357194043076
"advise food service managers and organizations on sanitation, safety procedures, menu development, budgeting, and planning to assist with the establishment, operation, and evaluation of food service facilities and nutrition programs.",0.004429909708016834
advise internal management or business partners on the implementation or operation of compliance programs.,0.004299618246016338
"advise management about issues such as resource utilization, tax strategies, and the assumptions underlying budget forecasts.",0.002736120702010397
"advise management concerning personnel, managerial, and marketing policies and practices and their potential effects on organizational effectiveness and efficiency.",0.05133483602819507
advise management on matters related to the administration of contracts or employee discipline or grievance procedures.,0.002214954854008417
"advise management on short-term and long-term financial objectives, policies, and actions.",0.003908743860014853
"advise management regarding customer satisfaction, product performance, or suggestions for product improvements.",0.007817487720029706
"advise managers and employees on state and federal employment regulations, collective agreements, benefit and compensation policies, personnel procedures and classification programs.",0.007426613334028221
"advise managers on organizational policy matters such as equal employment opportunity and sexual harassment, and recommend needed changes.",0.007947779182030202
advise or assist in obtaining patents or meeting other legal requirements.,0.014332060820054462
advise or consult with individuals and institutions regarding issues such as the historical authenticity of materials or the customs of a specific historical period.,0.011595940118044063
"advise or instruct patients regarding preventive dental care, the causes and treatment of dental problems, or oral health care services.",0.021367799768081196
"advise patients and community members concerning diet, activity, hygiene, and disease prevention.",0.002214954854008417
"advise patients and their families on nutritional principles, dietary plans and diet modifications, and food selection and preparation.",0.019674010762074763
"advise planning officials on project feasibility, cost-effectiveness, regulatory conformance, or possible alternatives.",0.008078070644030697
advise producers about improved products and techniques that could enhance their animal production efforts.,0.0046904926320178245
"advise project teams on subjects such as premarket regulatory requirements, export and labeling requirements, or clinical study compliance issues.",0.004820784094018319
"advise retail customers or internal users on the appropriateness of parts, supplies, or materials requested.",0.002866412164010892
advise students on academic and vocational curricula and career issues.,0.004039035322015348
advise students on academic and vocational curricula and on career issues.,0.02241013146408516
"advise students on academic and vocational curricula, and on career issues.",0.026058292400099024
"advise students on academic and vocational curricula, career issues, and laboratory and field research.",0.010553608422040103
"advise students on course selection, career decisions, and other academic and vocational concerns.",0.009641568188036638
"advise students on internships, prospective employers, and job placement services.",0.0031269950880118825
"advise students on issues such as course selection, progress toward graduation, and career decisions.",0.006514573100024756
"advise teaching and administrative staff in curriculum development, use of materials and equipment, and implementation of state and federal programs and procedures.",0.002475537778009407
advocate for accessible health care that minimizes environmental health risks.,0.003257286550012378
"advocate for patients' and families' needs, or provide emotional support for patients and their families.",0.004039035322015348
agree on buying or selling prices at optimal levels for clients.,0.0019543719300074264
"aid patients in performing tasks, such as bathing or keeping beds, clothing, or living areas clean.",0.002214954854008417
"align, adjust, or calibrate equipment according to specifications.",0.021107216844080207
"allocate print space for story text, photos, and illustrations according to space parameters and copy significance, using knowledge of layout principles.",0.050553087256192106
"analyze a script, noting events that affect each character's appearance, so that plans can be made for each scene.",0.00586311579002228
analyze all aspects of corporate logistics to determine the most cost-effective or efficient means of transporting products or supplies.,0.01915284491407278
"analyze and characterize user experiences and institutional settings to assist consumer product developers, technology developers, and software engineers with the design of innovative products and services.",0.01784993029406783
analyze and classify risks and investments to determine their potential impacts on companies.,0.037523941056142596
"analyze and distill climate-related research findings to inform legislators, regulatory agencies, or other stakeholders.",0.003778452398014358
analyze and evaluate patient data or test findings to diagnose nature or extent of mental disorder.,0.005732824328021784
analyze and evaluate robotic systems or prototypes.,0.004951075556018814
"analyze and evaluate security operations to identify risks or opportunities for improvement through auditing, review, or assessment.",0.13980273872653126
"analyze and implement engineering designs for producing electronic devices and systems and microprocessor-based control applications, applying principles of mathematics, digital signal processing, network analysis, and computer engineering.",0.010814191346041094
analyze and interpret data to increase the understanding of human social behavior.,0.08833761123633568
analyze and interpret news and information received from various sources to broadcast the information.,0.008208362106031193
"analyze and interpret patient, nursing, or information systems data to improve nursing services.",0.021367799768081196
"analyze and interpret patients' histories, symptoms, physical findings, or diagnostic information to develop appropriate diagnoses.",0.05042279579419161
"analyze and interpret results from tests such as microbial or parasite tests, urine analyses, hormonal assays, fine needle aspirations (fnas), and polymerase chain reactions (pcrs).",0.02553712655209704
analyze and interpret statistical data to identify significant differences in relationships among sources of information.,0.002084663392007922
analyze and modify compensation and benefits policies to establish competitive programs and ensure compliance with legal requirements.,0.00690544748602624
"analyze and recommend chemical, biological, or other wastewater treatment methods to prepare water for industrial or domestic use.",0.006253990176023765
analyze and record personnel or operational data and write related activity reports.,0.003908743860014853
"analyze and record test data to issue reports that use charts, graphs, or narratives.",0.06814243462625894
analyze and report computer network security breaches or attempted breaches.,0.045862594624174274
"analyze applicants' financial status, credit, and property evaluations to determine feasibility of granting loans.",0.0019543719300074264
analyze available data and consult with other scientists to determine parameters of experimentation and suitability of analytical models.,0.031009367956117837
"analyze building codes, by-laws, space and site requirements, and other technical documents and reports to determine their effect on architectural designs.",0.006514573100024756
"analyze business operations, trends, costs, revenues, financial commitments, and obligations to project future revenues and expenses or to provide advice.",0.16560044820262929
analyze changes designed to improve the environmental performance of complex systems to avoid unintended negative consequences.,0.019934593686075752
analyze characteristics of animals to identify and classify them.,0.039608604448150515
analyze clinical data using appropriate statistical tools.,0.011595940118044063
"analyze clinical or survey data using statistical approaches such as longitudinal analysis, mixed effect modeling, logistic regression analyses, and model building techniques.",0.004429909708016834
"analyze compensation policies, government regulations, and prevailing wage rates to develop competitive compensation plan.",0.011856523042045054
"analyze competitive market strategies through analysis of related product, market, or share trends.",0.04091151906815546
analyze completed police reports to determine what additional information and investigative work is needed.,0.010293025498039114
"analyze complex systems to determine potential for further development, production, interoperability, compatibility, or usefulness in a particular area, such as aviation.",0.03126995088011882
"analyze computer and information technologies to determine applicability to nursing practice, education, administration and research.",0.008859819416033667
"analyze corporate intelligence data to identify trends, patterns, or warnings indicating threats to security of people, assets, information, or infrastructure.",0.03400607158212922
analyze credit data and financial statements to determine the degree of risk involved in extending credit or lending money.,0.01120506573204258
analyze customer bills and utility rate structures to select optimal rate structures for customers.,0.002084663392007922
"analyze data from surveys, old records, or case studies, using statistical software.",0.02983674479811338
"analyze data such as interview notes, test results, and reference manuals to identify symptoms and to diagnose the nature of clients' problems.",0.03153053380411982
analyze data to assess distance learning program status or to inform decisions for distance learning programs.,0.029054996026110412
analyze data to determine answers to questions from customers or members of the public.,0.02736120702010397
analyze data to determine feasibility of product proposals.,0.004560201170017329
analyze data to determine the effectiveness of specific treatments or therapy approaches.,0.005472241404020794
analyze data to determine the effectiveness of treatments or therapy approaches.,0.004429909708016834
"analyze data to determine validity, quality, and scientific significance and to interpret correlations between human activities and environmental effects.",0.003648160936013863
"analyze data, using statistical methods and applications, to evaluate the outcomes and effectiveness of workplace programs.",0.0023452463160089122
analyze details of sales territories to assess their growth potential and to set quotas.,0.0029967036260113876
"analyze determinants responsible for specific inherited traits, and devise methods for altering traits or producing new traits.",0.005732824328021784
analyze developments in specific field to determine need for revisions in previously published materials and development of new material.,0.12325572305246837
"analyze electronics system requirements, capacity, cost, or customer needs to determine project feasibility.",0.02058605099607823
analyze employment-related data and prepare required reports.,0.004299618246016338
"analyze energy requirements and distribution systems to maximize the use of intermittent or inflexible renewable energy sources, such as wind or nuclear.",0.006253990176023765
"analyze engineering designs of logic or digital circuitry, motor controls, instrumentation, or data acquisition for implementation into new or existing automated, servomechanical, or other electromechanical systems.",0.004169326784015844
analyze equipment performance records to assess equipment functioning.,0.005732824328021784
analyze equipment performance records to determine the need for repair or replacement.,0.0035178694740133683
analyze existing development or manufacturing procedures and suggest improvements.,0.010944482808041589
"analyze expenditures and other financial information to develop plans, policies, or budgets for increasing profits or improving services.",0.02501596070409506
analyze experimental data and interpret results to write reports and summaries of findings.,0.12156193404646194
"analyze factors such as weather reports, fuel requirements, or maps to determine air routes.",0.002214954854008417
analyze financial activities of establishments or departments and provide input into budget planning and preparation processes.,0.02697033263410249
"analyze financial data such as income growth, quality of management, and market share to determine expected profitability of loans.",0.004951075556018814
"analyze financial data to detect irregularities in areas such as billing trends, financial relationships, and regulatory compliance procedures.",0.012638271814048026
analyze financial information obtained from clients to determine strategies for meeting clients' financial objectives.,0.0878164453883337
analyze financial or operational performance of companies facing financial difficulties to identify or recommend remedies.,0.06188844445023518
"analyze geographic distributions of physical and cultural phenomena on local, regional, continental, or global scales.",0.002736120702010397
"analyze geographic information systems (gis) data to identify spatial relationships or display results of analyses, using maps, graphs, or tabular data.",0.002475537778009407
analyze green product marketing or sales trends to forecast future conditions.,0.002475537778009407
analyze information from traffic counting programs.,0.0023452463160089122
analyze information gathered by investigation and report findings and recommendations.,0.016286432750061888
analyze information obtained from management to conceptualize and define operational problems.,0.07009680655626636
"analyze information processing or computation needs and plan and design computer systems, using techniques such as structured analysis, data modeling and information engineering.",0.06345194199424112
"analyze information to determine, recommend, and plan computer specifications and layouts, and peripheral equipment modifications.",0.09693684772836836
"analyze information to determine, recommend, and plan installation of a new system or modification of an existing system.",0.05341949942020299
"analyze information to determine, recommend, and plan layout, including type of computers and peripheral equipment modifications.",0.426574246589621
"analyze job requirements and content to establish criteria for classification, selection, training, and other related personnel functions.",0.0046904926320178245
analyze laboratory findings to check the accuracy of the results.,0.025406835090096544
"analyze large molecular datasets such as raw microarray data, genomic sequence data, and proteomics data for clinical or basic research purposes.",0.04833813240218368
"analyze logistics data, using methods such as data mining, data modeling, or cost or benefit analysis.",0.010293025498039114
analyze market conditions to determine optimum times to execute securities transactions.,0.058891740824223784
analyze member participation or changes in congregational emphasis to determine needs for religious education.,0.0029967036260113876
"analyze menus or recipes, standardize recipes, or test new products.",0.005993407252022775
analyze monthly department budgeting and accounting reports to maintain expenditure controls.,0.002214954854008417
"analyze network data to determine network usage, disk space availability, or server function.",0.021758674154082683
analyze new legislation to determine impact on risk exposure.,0.003778452398014358
analyze new medical procedures to forecast likely outcomes.,0.0019543719300074264
"analyze operation of wind farms or wind farm components to determine reliability, performance, and compliance with specifications.",0.002866412164010892
"analyze operations to evaluate performance of a company or its staff in meeting objectives or to determine areas of potential cost reduction, program improvement, or policy change.",0.24116949616291647
analyze or evaluate dental needs to determine changes or trends in patterns of dental disease.,0.003908743860014853
"analyze or interpret logistics data involving customer service, forecasting, procurement, manufacturing, inventory, transportation, or warehousing.",0.02449479485609308
"analyze or manipulate bioinformatics data using software packages, statistical applications, or data mining techniques.",0.005993407252022775
analyze or synthesize client data to draw conclusions or make recommendations for therapy.,0.02058605099607823
"analyze organic or inorganic compounds to determine chemical or physical properties, composition, structure, relationships, or reactions, using chromatography, spectroscopy, or spectrophotometry techniques.",0.2211046110148402
"analyze organizational, occupational, and industrial data to facilitate organizational functions and provide technical information to business, industry, and government.",0.3454026657633125
"analyze originals to evaluate color density, gradation highlights, middle tones, and shadows, using densitometers and knowledge of light and color.",0.00586311579002228
"analyze patient's medical history, medication allergies, physical condition, and examination results to verify operation's necessity and to determine best procedure.",0.006775156024025746
analyze patrons' hair and other physical features to determine and recommend beauty treatment or suggest hair styles.,0.009771859650037133
analyze patrons' requests to determine needed information and assist in furnishing or locating that information.,0.037914815442144076
"analyze performance data to determine effectiveness of instructional systems, courses, or instructional materials.",0.05081367018019309
analyze physical findings and medical histories to make diagnoses according to oriental medicine traditions.,0.005081367018019309
analyze potential loan markets and develop referral networks to locate prospects for loans.,0.007035738948026737
analyze potential loan markets to find opportunities to promote loans and financial services.,0.003778452398014358
analyze prescribing trends to monitor patient compliance and to prevent excessive usage or harmful interactions.,0.0029967036260113876
"analyze price proposals, financial reports, and other data and information to determine reasonable prices.",0.023322171698088624
analyze problems and take appropriate action to ensure continuous and reliable operation of equipment and systems.,0.002475537778009407
analyze problems to develop solutions involving computer hardware and software.,0.07322380164427825
analyze product complaints and make recommendations regarding their reportability.,0.0046904926320178245
analyze quality control test results and provide feedback and interpretation to production management or staff.,0.002866412164010892
