task_name,pct
prepare written reports of investigation findings.,0.002866412164010892
prepare written reports on investigations.,0.004169326784015844
"prepare written reports that estimate property values, outline methods by which the estimations were made, and meet appraisal standards.",0.005472241404020794
"prepare, administer, and grade tests and assignments to evaluate students' progress.",0.030097327722114372
"prepare, administer, or grade tests or assignments to evaluate students' progress.",0.004299618246016338
"prepare, analyze, and verify annual reports, financial statements, and other records, using accepted accounting and statistical procedures to assess financial condition and facilitate financial planning.",0.06097640421623171
"prepare, examine, or analyze accounting records, financial statements, or other financial reports to assess accuracy, completeness, and conformance to reporting and procedural standards.",0.005732824328021784
"prepare, maintain, and record records of inventories, receipts, purchases, or deliveries, using a variety of computer screen formats.",0.002214954854008417
"prepare, maintain, and review purchasing files, reports and price lists.",0.002866412164010892
"prepare, maintain, or update security procedures, security system drawings, or related documentation.",0.0320516996521218
"prepare, manipulate, and manage extensive databases.",0.03296373988612526
"prepare, review, or coordinate ongoing modifications to contract specifications or plans.",0.002605829240009902
"prepare, review, or maintain maintenance schedules, design documentation, or operational reports or charts.",0.00612369871402327
"prepare, rewrite and edit copy to improve readability, or supervise others who do this work.",1.0044168805618168
"prescribe individualized exercise programs, specifying equipment such as treadmill, exercise bicycle, ergometers, or perceptual goggles.",0.006514573100024756
"prescribe medication dosages, routes, and frequencies based on patient characteristics such as age and gender.",0.0019543719300074264
"prescribe medications based on efficacy, safety, and cost as legally authorized.",0.0029967036260113876
"present and explain proposals, reports, or findings to clients.",0.092897812406353
"present and make recommendations regarding course design, technology, and instruction delivery options.",0.058109992052220824
present clear and concise explanations of governing rules and regulations.,0.02019517661007674
present clients with information required to make informed health care and treatment decisions.,0.028142955792106947
"present data, maps, or other information at construction-related public hearings or meetings.",0.005472241404020794
present designs and reports to customers or design committees for approval and discuss need for modification.,0.01120506573204258
present drafts and ideas to clients.,0.007035738948026737
"present historical accounts in terms of individuals or social, ethnic, political, economic, or geographic groupings.",0.004039035322015348
"present information in audio-visual or interactive formats, using computers, television, audio-visual aids, or other equipment, materials, or technologies.",0.016286432750061888
"present information in audio-visual or interactive formats, using computers, televisions, audio-visual aids, or other equipment, materials, or technologies.",0.016156141288061393
"present information using a variety of instructional techniques or formats, such as role playing, simulations, team exercises, group discussions, videos, or lectures.",0.030488202108115856
"present investment information, such as product risks, fees, or fund performance statistics.",0.07309351018227776
"present lectures and conduct discussions to increase students' knowledge and competence using visual aids, such as graphs, charts, videotapes, and slides.",0.009511276726036143
"present menus to patrons and answer questions about menu items, making recommendations upon request.",0.002475537778009407
"present oral or written reports on general economic trends, individual corporations, and entire industries.",0.06840301755025993
"present project plans or designs to public stakeholders, such as government agencies or community groups.",0.010683899884040598
present research findings at national meetings or in peer-reviewed journals.,0.002475537778009407
present research findings at scientific conferences and in papers written for scientific journals.,0.007687196258029211
present research findings to groups of people.,0.030097327722114372
"present statistical and nonstatistical results using charts, bullets, and graphs in meetings or conferences to audiences such as clients, peers, and students.",0.011335357194043076
"present water resource proposals to government, public interest groups, or community groups.",0.002736120702010397
"preserve records, documents, and objects, copying records to film, videotape, audiotape, disk, or computer formats as necessary.",0.005341949942020299
"press and adjust controls to activate, set, and regulate equipment according to specifications.",0.0029967036260113876
process all correspondence and paperwork related to accounts.,0.002736120702010397
process and prepare business or government forms.,0.0029967036260113876
"process and prepare documents, such as business or government forms and expense reports.",0.0927675209443525
"process and prepare memos, correspondence, travel vouchers, or other documents.",0.011074774270042085
process and record new insurance policies and claims.,0.002605829240009902
process and review employment applications to evaluate qualifications or eligibility of applicants.,0.028403538716107932
"process and review environmental permits, licenses, or related materials.",0.0035178694740133683
process blood or other fluid samples for further analysis by other medical professionals.,0.0029967036260113876
"process claims against the municipality, maintaining files and log of claims, and coordinate claim response and handling with municipal claims administrators.",0.006253990176023765
"process clinical data, including receipt, entry, verification, or filing of information.",0.010293025498039114
"process data for analysis, using computers.",0.10931453661841539
"process large amounts of data for statistical modeling and graphic analysis, using computers.",0.07322380164427825
process print and non-print library materials to prepare them for inclusion in library collections.,0.002214954854008417
"process, prepare, and submit business or government forms, such as submitting applications for coverage to insurance carriers.",0.015374392516058422
"process, verify, and maintain personnel related documentation, including staffing, recruitment, training, grievances, performance evaluations, classifications, and employee leaves of absence.",0.018501387604070305
"procure, produce, and provide information on the safe operation of aircraft, such as flight planning publications, operations publications, charts and maps, and weather information.",0.006253990176023765
"produce detailed images or measurement of objects, using tools such as scanning tunneling microscopes or oscilloscopes.",0.01172623158004456
"produce documentation of the questionnaire development process, data collection methods, sampling designs, and decisions related to sample statistical weighting.",0.002214954854008417
"produce medical reports, correspondence, records, patient-care information, statistics, medical research, and administrative material.",0.04416880561816784
"produce pharmaceutically or industrially useful proteins, using recombinant dna technology.",0.002084663392007922
"produce reports or presentations that outline findings, explain risk positions, or recommend changes.",0.0239736290080911
produce rough and finished graphics and graphic designs.,0.014332060820054462
"produce up-to-the-minute information, using internal computer systems, to allow management to base decisions on actual, not historical, data.",0.059934072520227755
produce written summary reports of financial research results.,0.027882372868105954
"program complex robotic systems, such as vision systems.",0.002866412164010892
program computerized graphic effects.,0.032442574038123284
"program computers or electronic instruments, such as numerically controlled machine tools.",0.003648160936013863
program computers to operate machinery.,0.003908743860014853
program electronic equipment.,0.07752341989029458
"program, adjust, or configure inverters and controls for desired set points and operating modes.",0.0019543719300074264
promote awareness or use of alternative or renewable energy sources.,0.008859819416033667
"promote products in online communities through weblog or discussion-forum postings, e-mail marketing programs, or online advertising.",0.010293025498039114
"promote sales of properties through advertisements, open houses, and participation in multiple listing services.",0.023713046084090108
"promote the university by participating in community, state, and national events or meetings, and by developing partnerships with industry and secondary education institutions.",0.004951075556018814
"proofread, edit, and revise translated materials.",0.060585529830230224
propose logistics solutions for customers.,0.004299618246016338
"propose new or modified policies involving use of traditional and alternative fuels, transportation of goods, and other factors relating to climate and climate change.",0.01224739742804654
"propose product designs involving microelectromechanical systems (mems) technology, considering market data or customer requirements.",0.005341949942020299
protect and control proprietary materials.,0.008990110878034162
provide administrative or technical assistance to those receiving transportation-related grants.,0.003257286550012378
"provide administrative support for projects by collecting data, providing project documentation, training staff, or performing other general administrative duties.",0.004299618246016338
"provide advice and consultation on economic relationships to businesses, public and private agencies, and other employers.",0.05381037380620448
"provide advice and technical assistance with cost analysis, fiscal allocation, and budget preparation.",0.003648160936013863
provide advice on best practices and implementation for selection.,0.02449479485609308
"provide advice on project costs, design concepts, or design changes.",0.008208362106031193
"provide advice on transportation options, types of carriers, or shipping routes.",0.009120402340034658
provide advice or information to park or reserve visitors.,0.003648160936013863
"provide advice to clients on a contract basis, working as a consultant.",0.016937890060064364
provide aircrews with information and services needed for airfield management and flight planning.,0.003908743860014853
"provide analytical support for the design and development of training curricula, learning strategies, educational policies, or courseware standards.",0.013029146200049512
provide applicants with assistance in completing application forms such as those for job referrals or unemployment compensation claims.,0.011465648656043569
provide application or analytical support to researchers or traders on issues such as valuations or data.,0.01198681450404555
"provide assistance in dressing or changing seriously ill, injured, or disabled patients.",0.002214954854008417
provide assistance in the design of survey instruments such as questionnaires.,0.00638428163802426
"provide assistance or direction to other stockroom, warehouse, or storage yard workers.",0.0031269950880118825
"provide assistance to faculty and staff in duties such as teaching classes, conducting orientation programs, issuing transcripts, and scheduling events.",0.004560201170017329
provide assistance to students in college writing centers.,0.16090995557061144
"provide assistance with the preparation of project-related reports, manuscripts, and presentations.",0.003257286550012378
"provide clear, detailed descriptions of web site specifications, such as product features, activities, software, communication protocols, programming languages, and operating systems software and hardware.",0.056155620122213395
"provide clients or family members with information about addiction issues and about available services or programs, making appropriate referrals when necessary.",0.02227984000208466
"provide clients with communication assistance, typing their correspondence or obtaining information for them.",0.028664121640108925
"provide clients with guidance and information about techniques for postural improvement and stretching, strengthening, relaxation, and rehabilitative exercises.",0.011335357194043076
"provide clinical instruction, supervision or training to staff in areas such as anesthesia practices.",0.0031269950880118825
provide clinical services or health education to improve and maintain the oral health of patients or the general public.,0.00690544748602624
provide consultation and surgical assistance to other physicians and surgeons.,0.0031269950880118825
provide consultation or training on topics such as mechatronics or automated control.,0.009771859650037133
"provide consultation or training to volunteers or staff on topics such as guest relations, patients' rights, and medical issues.",0.007687196258029211
"provide consultation to clients or other engineers on topics such as climate control systems, energy modeling, data logging, energy management control systems, lighting or daylighting design, sustainable design, and energy auditing.",0.004560201170017329
"provide consultation to organizations or agencies on the workplace application of safety principles, practices, or techniques.",0.0023452463160089122
"provide consultation to parents, teachers, administrators, and others on topics such as learning styles and behavior modification techniques.",0.00638428163802426
"provide consultation, support, or education to groups such as parents and teachers.",0.0239736290080911
"provide consulting services in fields such as resource development and management, business location and market area analysis, environmental hazards, regional cultural history, and urban social planning.",0.004169326784015844
provide consulting services to other physicians.,0.0019543719300074264
"provide counseling to patient and family members by providing information, education, or reassurance.",0.0023452463160089122
"provide counseling to radiologic patients to explain the processes, risks, benefits, or alternative treatments.",0.002214954854008417
"provide current and prospective employees with information about policies, job duties, working conditions, wages, opportunities for promotion and employee benefits.",0.010553608422040103
"provide customer assistance and information, such as giving directions or handling wheelchairs.",0.0035178694740133683
provide customer service by greeting and assisting customers and responding to customer inquiries and complaints.,0.009771859650037133
"provide customer support and education, working with users to identify needs, determine sources of problems, or to provide information on product use.",0.020064885148076247
"provide customer with brochures and publications containing travel information, such as local customs, points of interest, or foreign country regulations.",0.0029967036260113876
provide customers with information about casino operations.,0.002866412164010892
"provide customers with information about the uses, effects, or interactions of drugs.",0.01941342783807377
"provide customers with information on routes, gates, prices, timetables, terminals, or concourses.",0.0035178694740133683
"provide customers with information such as quotes, orders, sales, shipping, warranties, credit, funding options, incentives, or tax rebates.",0.00638428163802426
"provide customers with travel suggestions and information sources, such as guides, directories, brochures, and maps.",0.029445870412111892
provide detailed port information to importers or exporters.,0.003778452398014358
"provide dietitians with assistance researching food, nutrition, or food service systems.",0.003648160936013863
"provide direct assistance to farmers by performing activities such as purchasing or selling products and supplies, supervising properties, and collecting soil and herbage samples for testing.",0.005472241404020794
provide direction and assistance to other organizational units regarding accounting and budgeting policies and procedures and efficient control and utilization of financial resources.,0.003648160936013863
provide directions and respond to passenger inquiries.,0.004039035322015348
"provide documentation and information to account for delays, difficulties, or changes to cost estimates.",0.002084663392007922
"provide educational information about physical therapy or physical therapists, injury prevention, ergonomics, or ways to promote health.",0.013029146200049512
"provide educational programs on topics such as classroom management, teaching strategies, or parenting skills.",0.0029967036260113876
provide emergency medical instructions to callers.,0.004299618246016338
provide employees with guidance in handling difficult or complex problems or in resolving escalated complaints or disputes.,0.01784993029406783
"provide expertise in the design, management and evaluation of study protocols and health status questionnaires, sample selection and analysis.",0.002084663392007922
provide feedback and recommendations to developers on software usability and functionality.,0.132376125392503
provide feedback to health service providers regarding improving service accessibility or acceptability.,0.009902151112037629
"provide feedback to students using positive reinforcement techniques to encourage, motivate, or build confidence in students.",0.014722935206055946
provide formal and informal education to other staff members.,0.002475537778009407
provide guidance to agencies and organizations on assessment of health education needs and on development and delivery of health education programs.,0.002084663392007922
provide guidelines for implementing secure systems to customers or installation teams.,0.10983570246641738
provide human factors technical expertise on topics such as advanced user-interface technology development or the role of human users in automated or autonomous sub-systems in advanced vehicle systems.,0.0023452463160089122
provide individual support or counseling in general wellness or nutrition.,0.03530898620213417
"provide information about establishment, such as location of departments or offices, employees within the organization, or services provided.",0.003648160936013863
"provide information about facilities, entertainment options, and rules and regulations.",0.010683899884040598
"provide information about local features, such as shopping, dining, nightlife, or recreational destinations.",0.017719638832067335
"provide information about potential health hazards and possible interventions to the media, the public, other health care professionals, or local, state, and federal health authorities.",0.002475537778009407
"provide information about rental items, such as availability, operation, or description.",0.002475537778009407
"provide information about the physical and emotional processes involved in the pregnancy, labor, birth, and postpartum periods.",0.007426613334028221
"provide information about wildlife varieties and habitats, as well as any relevant regulations, such as those pertaining to hunting and fishing.",0.0023452463160089122
"provide information and advice regarding drug interactions, side effects, dosage, and proper medication storage.",0.023582754622089617
"provide information and advice to the public regarding the selection, purchase, and care of products.",0.039348021524149526
provide information for teachers and staff members involved in helping students or graduates identify and pursue employment opportunities.,0.002475537778009407
provide information from the institution's holdings to other curators and to the public.,0.034266654506130215
"provide information or counseling regarding issues such as animal health care, behavior problems, or nutrition.",0.005211658480019804
"provide information or recommendations to farmers or other landowners regarding ways in which they can best use land, promote plant growth, or avoid or correct problems such as erosion.",0.008468945030032182
"provide information or technical or program assistance to government representatives, employers, or the general public on the issues of public health, environmental protection, or workplace safety.",0.0035178694740133683
provide information regarding the judicial system or other legal issues through the media and public speeches.,0.008990110878034162
"provide information to employees and managers on payroll matters, tax issues, benefit plans, and collective agreement provisions.",0.004429909708016834
provide information to the public by leading workshops and training programs and by developing educational materials.,0.002214954854008417
"provide information to the public regarding trees, such as advice on tree care.",0.004820784094018319
"provide information, guidance, and preparation for the general equivalency diploma (ged) examination.",0.002605829240009902
"provide information, technical assistance, or training to supervisors, managers, or employees on topics such as employee supervision, hiring, grievance procedures, or staff development.",0.007687196258029211
"provide instructions to clients on how to obtain help with legal, financial, and other personal issues.",0.006514573100024756
provide instructors with assistance in the use of audiovisual equipment.,0.002214954854008417
"provide management with information or training related to interviewing, performance appraisals, counseling techniques, or documentation of performance issues.",0.004169326784015844
"provide occupational, educational, and other information to individuals so that they can make educational and vocational plans.",0.11621998410444165
provide or coordinate troubleshooting support for data warehouses.,0.00612369871402327
provide patients or caregivers with assistance in locating health care resources.,0.003908743860014853
"provide patients with direct family planning services such as inserting intrauterine devices, dispensing oral contraceptives, and fitting cervical barriers including cervical caps or diaphragms.",0.002475537778009407
"provide patients with information needed to promote health, reduce risk factors, or prevent disease or disability.",0.019543719300074265
provide postoperative instructions prescribed by dentist.,0.0023452463160089122
"provide primary health care, including pregnancy and childbirth, to women.",0.002084663392007922
"provide private instruction to individual or small groups of students to improve academic performance, improve occupational skills, or prepare for academic or occupational tests.",0.5365402405180388
provide professional consulting services to government or industry.,0.06319135907024012
"provide professional consulting services to government, educational institutions, or industry.",0.06162786152623419
"provide program information to the public by preparing and presenting press releases, conducting media campaigns, or maintaining program-related web sites.",0.003257286550012378
provide psychological or administrative services and advice to private firms and community agencies regarding mental health programs or individual cases.,0.002605829240009902
"provide public education and consultation to other professionals or groups regarding counseling services, issues, and methods.",0.020976925382079712
provide reference services and assistance for users needing archival materials.,0.012377688890047036
"provide regulatory guidance to departments or development project teams regarding design, development, evaluation, or marketing of products.",0.012898854738049016
provide requested information on students' progress and the development of case plans.,0.002084663392007922
provide road information to assist motorists.,0.02514625216609556
"provide scientific or technical guidance or expertise to scientists, engineers, technologists, technicians, or others, using knowledge of chemical, analytical, or biological processes as applied to micro and nanoscale systems.",0.01120506573204258
provide special services such as investment banking for clients with more specialized needs.,0.002084663392007922
"provide staff and users with assistance solving computer related problems, such as malfunctions and program problems.",0.002736120702010397
provide staff with assistance in performing difficult or complicated duties.,0.002736120702010397
"provide statistical and computational tools for biologically based activities such as genetic analysis, measurement of gene expression, and gene function determination.",0.006253990176023765
provide statistical modeling advice to other departments.,0.0029967036260113876
"provide students with information on such topics as college degree programs and admission requirements, financial aid opportunities, trade and technical schools, and apprenticeship programs.",0.025406835090096544
"provide support and information to functional areas such as marketing, clinical monitoring, and medical affairs.",0.00638428163802426
provide system design and integration recommendations.,0.1222133913564644
"provide technical advice on the use of current instructional technologies, including computer-based training, desktop videoconferencing, multimedia, and distance learning technologies.",0.06905447486026241
"provide technical advice to industrial or managerial personnel regarding design, construction, or program modifications or structural repairs.",0.0046904926320178245
